Question,Answer
"Морскую болезнь вызывают у меня люди, а не море. Но, боюсь, наука еще не нашла лекарства от этого недуга.","Морскую болезнь вызывают у меня люди, а не море. Но, боюсь, наука еще не нашла лекарства от этого недуга."
"Жизнь проходит и не кланяется, как сердитая соседка.","Жизнь проходит и не кланяется, как сердитая соседка."
"Ветер жизни иногда свиреп.
В целом жизнь, однако, хороша.
И не страшно, когда черный хлеб,
Страшно, когда черная душа...","Ветер жизни иногда свиреп.
В целом жизнь, однако, хороша.
И не страшно, когда черный хлеб,
Страшно, когда черная душа..."
"Жизнь была бы намного счастливее, если бы мы рождались в возрасте 80 лет и постепенно достигали 18 лет.","Жизнь была бы намного счастливее, если бы мы рождались в возрасте 80 лет и постепенно достигали 18 лет."
"Серая скука, и страх, и злоба - вот причины того, что жизнь столь коротка.","Серая скука, и страх, и злоба - вот причины того, что жизнь столь коротка."
"Когда ты хорошо делаешь свою работу, никто не обращает на это внимания. Но когда ты её портишь, дерьмо льётся изо всех дыр.","Когда ты хорошо делаешь свою работу, никто не обращает на это внимания. Но когда ты её портишь, дерьмо льётся изо всех дыр."
"Говорят, что труднее всего прожить первые семьдесят лет. А там дело пойдет на лад.","Говорят, что труднее всего прожить первые семьдесят лет. А там дело пойдет на лад."
Сняться в плохом фильме - все равно что плюнуть в вечность.,Сняться в плохом фильме - все равно что плюнуть в вечность.
"То, что Бог нам однажды отмерил, друзья,
Увеличить нельзя и уменьшить нельзя.
Постараемся с толком истратить наличность,
На чужое не зарясь, взаймы не прося.","То, что Бог нам однажды отмерил, друзья,
Увеличить нельзя и уменьшить нельзя.
Постараемся с толком истратить наличность,
На чужое не зарясь, взаймы не прося."
"Любовь умирает. Величайшая трагедия жизни состоит не в том, что люди гибнут, а в том, что они перестают любить.","Любовь умирает. Величайшая трагедия жизни состоит не в том, что люди гибнут, а в том, что они перестают любить."
"Единственное, что разрушает мечты — это компромисс.","Единственное, что разрушает мечты — это компромисс."
"Разве истинная человечность далеко от нас? Стоит возжелать ее, и она тут же окажется рядом!","Разве истинная человечность далеко от нас? Стоит возжелать ее, и она тут же окажется рядом!"
"Жизнь — пустыня, по ней мы бредем нагишом.
Смертный, полный гордыни, ты просто смешон!
Ты для каждого шага находишь причину —
Между тем он давно в небесах предрешен.","Жизнь — пустыня, по ней мы бредем нагишом.
Смертный, полный гордыни, ты просто смешон!
Ты для каждого шага находишь причину —
Между тем он давно в небесах предрешен."
"Мы учимся, увы, для школы, а не для жизни.","Мы учимся, увы, для школы, а не для жизни."
"Он ненавидел, когда его обзывали кретином. Все кретины ненавидят, когда их называют кретинами.","Он ненавидел, когда его обзывали кретином. Все кретины ненавидят, когда их называют кретинами."
"Можешь быть небрежным в одежде, — если это в твоем характере. Но душу надо содержать в опрятности.","Можешь быть небрежным в одежде, — если это в твоем характере. Но душу надо содержать в опрятности."
"Хорошие друзья, хорошие книги и спящая совесть - вот идеальная жизнь.","Хорошие друзья, хорошие книги и спящая совесть - вот идеальная жизнь."
"...люди и созданы, чтобы друг друга мучить.","...люди и созданы, чтобы друг друга мучить."
Самый лучший способ подбодрить себя — это подбодрить кого-нибудь.,Самый лучший способ подбодрить себя — это подбодрить кого-нибудь.
"Сейчас, когда человек стесняется сказать, что ему не хочется умирать, он говорит так: очень хочется выжить, чтобы посмотреть, что будет потом. Как будто если бы не это, он немедленно был бы готов лечь в гроб.","Сейчас, когда человек стесняется сказать, что ему не хочется умирать, он говорит так: очень хочется выжить, чтобы посмотреть, что будет потом. Как будто если бы не это, он немедленно был бы готов лечь в гроб."
"Двое начинают скучать не тогда, когда они долго находятся физически в одном месте. Они скучают, если далеки друг от друга ментально и духовно.","Двое начинают скучать не тогда, когда они долго находятся физически в одном месте. Они скучают, если далеки друг от друга ментально и духовно."
"Вот тест, чтобы понять, закончена ли твоя миссия на Земле. Если ты жив - то нет.","Вот тест, чтобы понять, закончена ли твоя миссия на Земле. Если ты жив - то нет."
"Прошлое отражается в нашем сознании сразу двумя зеркалами: одно яркое, в нем видно то, что мы когда-то сказали или сделали, другое темное, заполненное невысказанным и несделанным.","Прошлое отражается в нашем сознании сразу двумя зеркалами: одно яркое, в нем видно то, что мы когда-то сказали или сделали, другое темное, заполненное невысказанным и несделанным."
"Счастье - это когда тебя понимают, большое счастье - это когда тебя любят, настоящее счастье - это когда любишь ты.","Счастье - это когда тебя понимают, большое счастье - это когда тебя любят, настоящее счастье - это когда любишь ты."
"Неправда, что женатые мужчины при виде красивой женщины забывают о том, что они женаты. В эту минуту их особенно удручает именно воспоминание об этом.","Неправда, что женатые мужчины при виде красивой женщины забывают о том, что они женаты. В эту минуту их особенно удручает именно воспоминание об этом."
"Важное, значительное не может успокоить нас... Утешает всегда мелочь, пустяк...","Важное, значительное не может успокоить нас... Утешает всегда мелочь, пустяк..."
"Всегда надо учиться новому, если есть возможность.","Всегда надо учиться новому, если есть возможность."
"Есть слова, которые остаются в душе на всю жизнь.","Есть слова, которые остаются в душе на всю жизнь."
"Нельзя остановить перемены, как нельзя остановить восход солнца.","Нельзя остановить перемены, как нельзя остановить восход солнца."
"Мы — послушные куклы в руках у творца!
Это сказано мною не ради словца.
Нас по сцене всевышний на ниточках водит
И пихает в сундук, доведя до конца.","Мы — послушные куклы в руках у творца!
Это сказано мною не ради словца.
Нас по сцене всевышний на ниточках водит
И пихает в сундук, доведя до конца."
"Не зли других и сам не злись,
Мы гости в этом бренном мире.
И, если что не так — смирись!
Будь поумней и улыбнись.
Холодной думай головой.
Ведь в мире все закономерно:
Зло, излученное тобой,
К тебе вернется непременно.","Не зли других и сам не злись,
Мы гости в этом бренном мире.
И, если что не так — смирись!
Будь поумней и улыбнись.
Холодной думай головой.
Ведь в мире все закономерно:
Зло, излученное тобой,
К тебе вернется непременно."
"""Почему?"" - это вопрос, о который до сих пор разбивалась вся логика, вся философия, вся наука.","""Почему?"" - это вопрос, о который до сих пор разбивалась вся логика, вся философия, вся наука."
Никто не становится хорошим человеком случайно.,Никто не становится хорошим человеком случайно.
Если мы перестанем делать глупости - значит мы состарились.,Если мы перестанем делать глупости - значит мы состарились.
"Успех – это идея плюс воплощенный выбор. Оглянись вокруг: все, что ты видишь, к чему можешь прикоснуться руками, когда-то было лишь невидимой идеей, пока некто не воплотил ее в жизнь.","Успех – это идея плюс воплощенный выбор. Оглянись вокруг: все, что ты видишь, к чему можешь прикоснуться руками, когда-то было лишь невидимой идеей, пока некто не воплотил ее в жизнь."
"При встрече с достойным человеком думай о том, как сравняться с ним. Встречаясь с низким человеком, присматривайся к самому себе и сам себя суди.","При встрече с достойным человеком думай о том, как сравняться с ним. Встречаясь с низким человеком, присматривайся к самому себе и сам себя суди."
"Воображение важнее, чем знания. Знания ограничены, тогда как воображение охватывает целый мир, стимулируя прогресс, порождая эволюцию.","Воображение важнее, чем знания. Знания ограничены, тогда как воображение охватывает целый мир, стимулируя прогресс, порождая эволюцию."
"Развод отвратителен не только потому, что разлучает супругов, но и потому, что мужчину при этом называют свободным, а женщину — брошенной.","Развод отвратителен не только потому, что разлучает супругов, но и потому, что мужчину при этом называют свободным, а женщину — брошенной."
"Возможно, в этом мире ты — всего лишь человек, но для кого-то ты — весь мир.","Возможно, в этом мире ты — всего лишь человек, но для кого-то ты — весь мир."
"Новость сообщает тебе о том, что люди делали. А сплетня говорит, какое удовольствие они от этого получили.","Новость сообщает тебе о том, что люди делали. А сплетня говорит, какое удовольствие они от этого получили."
"Есть только два способа прожить свою жизнь. Первый – так, будто никаких чудес не бывает. Второй – так, будто все на свете является чудом.","Есть только два способа прожить свою жизнь. Первый – так, будто никаких чудес не бывает. Второй – так, будто все на свете является чудом."
"Старость - это просто свинство. Я считаю, что это невежество Бога, когда он позволяет доживать до старости.","Старость - это просто свинство. Я считаю, что это невежество Бога, когда он позволяет доживать до старости."
"Достойна только та жизнь, которая прожита ради других людей.","Достойна только та жизнь, которая прожита ради других людей."
Тебя обидел добрый человек? – Не верь. Дурной? – Не удивляйся.,Тебя обидел добрый человек? – Не верь. Дурной? – Не удивляйся.
Советов мы не любим – нам нужно поддакивание.,Советов мы не любим – нам нужно поддакивание.
"Есть люди, в которых живёт Бог; есть люди, в которых живёт Дьявол; а есть люди, в которых живут только глисты.","Есть люди, в которых живёт Бог; есть люди, в которых живёт Дьявол; а есть люди, в которых живут только глисты."
"Хотя мы никогда не забываем свою первую любовь, она всегда проходит.","Хотя мы никогда не забываем свою первую любовь, она всегда проходит."
"Никогда не переставай улыбаться! Даже когда тебе грустно, кто-то может влюбиться в твою улыбку.","Никогда не переставай улыбаться! Даже когда тебе грустно, кто-то может влюбиться в твою улыбку."
Имейте мужество жить. Умереть-то любой может.,Имейте мужество жить. Умереть-то любой может.
Одиночество как состояние не поддается лечению.,Одиночество как состояние не поддается лечению.
"Мужчина становится мужчиной только после того, как он завоюет любовь женщины, заслужит ее уважение и сохранит ее доверие, а без этого он не мужчина.","Мужчина становится мужчиной только после того, как он завоюет любовь женщины, заслужит ее уважение и сохранит ее доверие, а без этого он не мужчина."
"Ты выбрался из грязи в князи,
Но, быстро князем становясь,
Не позабудь, чтобы не сглазить,
Не вечны князи - вечна грязь.","Ты выбрался из грязи в князи,
Но, быстро князем становясь,
Не позабудь, чтобы не сглазить,
Не вечны князи - вечна грязь."
Без музыки жизнь была бы ошибкой.,Без музыки жизнь была бы ошибкой.
"Много лет размышлял я над жизнью земной.
Непонятного нет для меня под луной.
Мне известно, что мне ничего не известно, —
Вот последний секрет из постигнутых мной.","Много лет размышлял я над жизнью земной.
Непонятного нет для меня под луной.
Мне известно, что мне ничего не известно, —
Вот последний секрет из постигнутых мной."
"Приходится признать, что мы одиноки на этой планете, каждый из нас совершенно одинок, и чем скорее мы это признаем, тем лучше для нас.","Приходится признать, что мы одиноки на этой планете, каждый из нас совершенно одинок, и чем скорее мы это признаем, тем лучше для нас."
"Дружба между мужчиной и женщиной — это отношения либо бывших любовников, либо будущих.","Дружба между мужчиной и женщиной — это отношения либо бывших любовников, либо будущих."
В этой жизни вам нужны только невежество и уверенность в себе — и успех вам обеспечен.,В этой жизни вам нужны только невежество и уверенность в себе — и успех вам обеспечен.
"Бывают времена, когда люди принимают коллективную вонь за единство духа.","Бывают времена, когда люди принимают коллективную вонь за единство духа."
"Единственный человек, с которым вы должны сравнивать себя — это вы в прошлом. И единственный человек, лучше которого вы должны быть — это вы сейчас.","Единственный человек, с которым вы должны сравнивать себя — это вы в прошлом. И единственный человек, лучше которого вы должны быть — это вы сейчас."
Самая большая помеха жизни — ожидание завтрашнего дня и потеря сегодняшнего дня.,Самая большая помеха жизни — ожидание завтрашнего дня и потеря сегодняшнего дня.
"Сострадание к животным так тесно связано с добротой характера, что можно с уверенностью утверждать: кто жесток с животными, тот не может быть добрым человеком.","Сострадание к животным так тесно связано с добротой характера, что можно с уверенностью утверждать: кто жесток с животными, тот не может быть добрым человеком."
"Если толпу напугать, то она либо распинает, либо поклоняется.","Если толпу напугать, то она либо распинает, либо поклоняется."
"Мы в ответе за тех, кого приручили...","Мы в ответе за тех, кого приручили..."
"Благородный ни от кого не ожидает обмана, но когда его обманывают, он первый замечает это.","Благородный ни от кого не ожидает обмана, но когда его обманывают, он первый замечает это."
"Страшно, когда тебе внутри восемнадцать, когда восхищаешься прекрасной музыкой, стихами, живописью, а тебе уже пора, ты ничего не успела, а только начинаешь жить!","Страшно, когда тебе внутри восемнадцать, когда восхищаешься прекрасной музыкой, стихами, живописью, а тебе уже пора, ты ничего не успела, а только начинаешь жить!"
"Я ведь еще помню порядочных людей...  Боже, какая я старая!","Я ведь еще помню порядочных людей...  Боже, какая я старая!"
"Увы, не много дней нам здесь побыть дано,
Прожить их без любви и без вина — грешно.
Не стоит размышлять, мир этот стар иль молод:
Коль суждено уйти — не все ли нам равно?","Увы, не много дней нам здесь побыть дано,
Прожить их без любви и без вина — грешно.
Не стоит размышлять, мир этот стар иль молод:
Коль суждено уйти — не все ли нам равно?"
"Пока выбор не сделан, все на свете возможно.","Пока выбор не сделан, все на свете возможно."
Российская власть должна держать свой народ в состоянии постоянного изумления.,Российская власть должна держать свой народ в состоянии постоянного изумления.
Национализм — детская болезнь. Это корь человечества.,Национализм — детская болезнь. Это корь человечества.
"Не плачь, потому что это закончилось. Улыбнись, потому что это было.","Не плачь, потому что это закончилось. Улыбнись, потому что это было."
"Слушай беззвучие, слушай и наслаждайся тем, чего тебе не давали в жизни — тишиной.","Слушай беззвучие, слушай и наслаждайся тем, чего тебе не давали в жизни — тишиной."
