Question,Answer
"От судьбы никому не уйти. И никто не знает, когда она тебя настигнет.","От судьбы никому не уйти. И никто не знает, когда она тебя настигнет."
"Скупец, не причитай, что плохи времена.
Все, что имеешь, — трать. Запомни: жизнь одна.
Сколь злата ни награбь, а в мир иной отсюда
Не унесешь, представь, и горсточки зерна.","Скупец, не причитай, что плохи времена.
Все, что имеешь, — трать. Запомни: жизнь одна.
Сколь злата ни награбь, а в мир иной отсюда
Не унесешь, представь, и горсточки зерна."
"Наблюдайте за поведением человека, вникайте в причины его поступков, приглядывайтесь к нему в часы его досуга. Останется ли он тогда для вас загадкой?","Наблюдайте за поведением человека, вникайте в причины его поступков, приглядывайтесь к нему в часы его досуга. Останется ли он тогда для вас загадкой?"
Зорко одно лишь сердце. Самого главного глазами не увидишь.,Зорко одно лишь сердце. Самого главного глазами не увидишь.
"Людям нужно во что-то верить. Жизнь настолько короткая и опасная, что приходится верить в то, что будет после неё.","Людям нужно во что-то верить. Жизнь настолько короткая и опасная, что приходится верить в то, что будет после неё."
"Благородный превыше всего почитает долг. Благородный человек, наделенный отвагой, но не ведающий долга, может стать мятежником. Низкий человек, наделенный отвагой, но не ведающий долга, может пуститься в разбой.","Благородный превыше всего почитает долг. Благородный человек, наделенный отвагой, но не ведающий долга, может стать мятежником. Низкий человек, наделенный отвагой, но не ведающий долга, может пуститься в разбой."
"И они ждут Прекрасного Принца, вбив себе в голову этот дурацкий рекламный образ, который плодит неудачниц, будущих старых дев и мегер, потому что счастливыми-то их сделать может только мужчина, далекий от совершенства.","И они ждут Прекрасного Принца, вбив себе в голову этот дурацкий рекламный образ, который плодит неудачниц, будущих старых дев и мегер, потому что счастливыми-то их сделать может только мужчина, далекий от совершенства."
"Не заблуждайтесь в мысли, что мир вам чем-то обязан — он был до вас и ничего вам не должен.","Не заблуждайтесь в мысли, что мир вам чем-то обязан — он был до вас и ничего вам не должен."
"Тщеславные люди глухи ко всему, кроме похвал.","Тщеславные люди глухи ко всему, кроме похвал."
"Разум, однажды расширивший свои границы, никогда не вернется в прежние.","Разум, однажды расширивший свои границы, никогда не вернется в прежние."
"Если человек идиот, то это надолго!","Если человек идиот, то это надолго!"
"Океан, состоящий из капель, велик.
Из пылинок слагается материк.
Твой приход и уход не имеет значенья.
Просто муха в окно залетела на миг.","Океан, состоящий из капель, велик.
Из пылинок слагается материк.
Твой приход и уход не имеет значенья.
Просто муха в окно залетела на миг."
"Если труженик, в поте лица своего
Добывающий хлеб, не стяжал ничего —
Почему он ничтожеству кланяться должен
Или даже тому, кто не хуже его?","Если труженик, в поте лица своего
Добывающий хлеб, не стяжал ничего —
Почему он ничтожеству кланяться должен
Или даже тому, кто не хуже его?"
"Семья заменяет все. Поэтому, прежде чем ее завести, стоит подумать, что тебе важнее: все или семья.","Семья заменяет все. Поэтому, прежде чем ее завести, стоит подумать, что тебе важнее: все или семья."
"Мужчина действует, а женщина ждёт - такова судьба. Но порой ждать куда тяжелее, чем действовать.","Мужчина действует, а женщина ждёт - такова судьба. Но порой ждать куда тяжелее, чем действовать."
Жизнь — это небольшая прогулка перед вечным сном.,Жизнь — это небольшая прогулка перед вечным сном.
"Тот, кто мир преподносит счастливчикам в дар,
Остальным за ударом наносит удар
Не горюй, что меньше других веселился,
Будь доволен, что меньше других пострадал.","Тот, кто мир преподносит счастливчикам в дар,
Остальным за ударом наносит удар
Не горюй, что меньше других веселился,
Будь доволен, что меньше других пострадал."
Изощренные слова губят добродетель. Несдержанность в мелочах погубит великое дело.,Изощренные слова губят добродетель. Несдержанность в мелочах погубит великое дело.
"Раскаяние – самая бесполезная вещь на свете. Вернуть ничего нельзя. Ничего нельзя исправить. Иначе все мы были бы святыми. Жизнь не имела в виду сделать нас совершенными. Тому, кто совершенен, место в музее.","Раскаяние – самая бесполезная вещь на свете. Вернуть ничего нельзя. Ничего нельзя исправить. Иначе все мы были бы святыми. Жизнь не имела в виду сделать нас совершенными. Тому, кто совершенен, место в музее."
"По своей воле вы оказались в мире, который создали для себя сами. Что держите в сердце своем, то и исполнится, чем больше всего восхищаетесь, тем и станете.","По своей воле вы оказались в мире, который создали для себя сами. Что держите в сердце своем, то и исполнится, чем больше всего восхищаетесь, тем и станете."
"В сей мир едва ли снова попадем,
Своих друзей вторично не найдем.
Лови же миг! Ведь он не повторится,
Как ты и сам не повторишься в нем.","В сей мир едва ли снова попадем,
Своих друзей вторично не найдем.
Лови же миг! Ведь он не повторится,
Как ты и сам не повторишься в нем."
"Ничего не бывает случайного, все имеет первопричину.","Ничего не бывает случайного, все имеет первопричину."
Единственный разумный способ обучать людей — это подавать им пример.,Единственный разумный способ обучать людей — это подавать им пример.
"Если я усну и проснусь через сто лет и меня спросят, что сейчас происходит в России, я отвечу: пьют и воруют...","Если я усну и проснусь через сто лет и меня спросят, что сейчас происходит в России, я отвечу: пьют и воруют..."
"Показывать можно только зрячим.
Петь песню — только тем, кто слышит.
Дари себя тому, кто будет благодарен,
Кто понимает, любит вас и ценит.","Показывать можно только зрячим.
Петь песню — только тем, кто слышит.
Дари себя тому, кто будет благодарен,
Кто понимает, любит вас и ценит."
"Чему быть - того не миновать. Ибо нет такого коня, на котором от самого себя ускакать можно.","Чему быть - того не миновать. Ибо нет такого коня, на котором от самого себя ускакать можно."
"Не существует такой проблемы, в которой не было бы бесценного дара для тебя. Ты создаёшь себе проблемы, потому что эти дары тебе крайне необходимы.","Не существует такой проблемы, в которой не было бы бесценного дара для тебя. Ты создаёшь себе проблемы, потому что эти дары тебе крайне необходимы."
"Если ты хочешь, чтобы кто-то остался в твоей жизни, - никогда не относись к нему равнодушно.","Если ты хочешь, чтобы кто-то остался в твоей жизни, - никогда не относись к нему равнодушно."
"Сколько бы мы ни старались, жизнь бежит быстрее нас, а если мы еще медлим, она проносится, словно не была нашей, и, хотя кончается в последний день, уходит от нас ежедневно.","Сколько бы мы ни старались, жизнь бежит быстрее нас, а если мы еще медлим, она проносится, словно не была нашей, и, хотя кончается в последний день, уходит от нас ежедневно."
"Старость - это когда беспокоят не плохие сны, а плохая действительность.","Старость - это когда беспокоят не плохие сны, а плохая действительность."
"Нет более жалкого зрелища, чем человек, объясняющий свою шутку.","Нет более жалкого зрелища, чем человек, объясняющий свою шутку."
"У меня такое чувство, будто я оказалась среди людей, которые собираются жить вечно. Во всяком случае, они так себя ведут. Их настолько занимают деньги, что они забыли о жизни.","У меня такое чувство, будто я оказалась среди людей, которые собираются жить вечно. Во всяком случае, они так себя ведут. Их настолько занимают деньги, что они забыли о жизни."
"Ни один человек не заслуживает твоих слез. А те, кто заслуживают, не заставят тебя плакать.","Ни один человек не заслуживает твоих слез. А те, кто заслуживают, не заставят тебя плакать."
"Всё приходит вовремя для того, кто умеет ждать.","Всё приходит вовремя для того, кто умеет ждать."
"Не надо стоять на перроне, пытаясь влезть в любой подъехавший состав. Следуйте расписанию своего сердца.","Не надо стоять на перроне, пытаясь влезть в любой подъехавший состав. Следуйте расписанию своего сердца."
"Только те, кто предпринимают абсурдные попытки, смогут достичь невозможного.","Только те, кто предпринимают абсурдные попытки, смогут достичь невозможного."
"Чем ниже человек душой,
Тем выше задирает нос.
Он носом тянется туда,
Куда душою не дорос.","Чем ниже человек душой,
Тем выше задирает нос.
Он носом тянется туда,
Куда душою не дорос."
"Ничто не обходится в жизни так дорого, как болезнь и — глупость.","Ничто не обходится в жизни так дорого, как болезнь и — глупость."
"Человек — единственное животное, способное краснеть. Впрочем, только ему и приходится.","Человек — единственное животное, способное краснеть. Впрочем, только ему и приходится."
"Если во имя идеала человеку приходится делать подлости, то цена этому идеалу — дерьмо.","Если во имя идеала человеку приходится делать подлости, то цена этому идеалу — дерьмо."
"Глупца можно узнать по двум приметам: он много говорит о вещах для него бесполезных и высказывается о том, про что его не спрашивают.","Глупца можно узнать по двум приметам: он много говорит о вещах для него бесполезных и высказывается о том, про что его не спрашивают."
"От безбожья до Бога — мгновенье одно!
От нуля до итога — мгновенье одно.
Береги драгоценное это мгновенье:
Жизнь — ни мало ни много — мгновенье одно!","От безбожья до Бога — мгновенье одно!
От нуля до итога — мгновенье одно.
Береги драгоценное это мгновенье:
Жизнь — ни мало ни много — мгновенье одно!"
"Тот, кто делает добро другому, делает больше всего добра самому себе, не в том смысле, что ему будет за это награда, а тем, что сознание сделанного добра дает ему большую радость.","Тот, кто делает добро другому, делает больше всего добра самому себе, не в том смысле, что ему будет за это награда, а тем, что сознание сделанного добра дает ему большую радость."
Всё проходит - это самая верная истина на свете.,Всё проходит - это самая верная истина на свете.
"Ловушки, ямы на моем пути –
Их бог расставил и велел идти.
И все предвидел. И меня оставил.
И судит! Тот, кто не хотел спасти!","Ловушки, ямы на моем пути –
Их бог расставил и велел идти.
И все предвидел. И меня оставил.
И судит! Тот, кто не хотел спасти!"
Все мы родом из детства.,Все мы родом из детства.
Самый верный способ справиться с соблазном — струсить...,Самый верный способ справиться с соблазном — струсить...
"Мы выбираем друг друга не случайно. Мы встречаем только тех, кто уже существует в нашем подсознании.","Мы выбираем друг друга не случайно. Мы встречаем только тех, кто уже существует в нашем подсознании."
"Чем больше узнаю людей, тем больше мне нравятся собаки.","Чем больше узнаю людей, тем больше мне нравятся собаки."
"Женщина может любить одновременно двух мужчин... до тех пор, пока один из них не узнает об этом.","Женщина может любить одновременно двух мужчин... до тех пор, пока один из них не узнает об этом."
Жить — значит медленно рождаться.,Жить — значит медленно рождаться.
"Если вы не думаете о будущем, у вас его не будет.","Если вы не думаете о будущем, у вас его не будет."
История нас рассудит.,История нас рассудит.
"Лучше иметь умного врага, чем дурного друга.","Лучше иметь умного врага, чем дурного друга."
"Не поговорить с человеком, который достоин разговора, значит потерять человека. А говорить с человеком, который разговора не достоин, — значит терять слова. Мудрый не теряет ни людей, ни слов.","Не поговорить с человеком, который достоин разговора, значит потерять человека. А говорить с человеком, который разговора не достоин, — значит терять слова. Мудрый не теряет ни людей, ни слов."
"Мы притягиваем в свою жизнь всё то, о чем думаем.","Мы притягиваем в свою жизнь всё то, о чем думаем."
"Удивления достойны поступки Творца!
Переполнены горечью наши сердца:
Мы уходим из этого мира, не зная
Ни начала, ни смысла его, ни конца.","Удивления достойны поступки Творца!
Переполнены горечью наши сердца:
Мы уходим из этого мира, не зная
Ни начала, ни смысла его, ни конца."
"Жизнь слишком коротка, чтобы тратить ее на диеты, жадных мужчин и плохое настроение.","Жизнь слишком коротка, чтобы тратить ее на диеты, жадных мужчин и плохое настроение."
"Вставай рано на рассвете и помни, что закат придет, когда его совсем не ждёшь.","Вставай рано на рассвете и помни, что закат придет, когда его совсем не ждёшь."
"Да, человек смертен, но это было бы еще полбеды. Плохо то, что он иногда внезапно смертен, вот в чем фокус!","Да, человек смертен, но это было бы еще полбеды. Плохо то, что он иногда внезапно смертен, вот в чем фокус!"
"Общаясь с дураком не оберешься срама,
Поэтому совет ты выслушай Хайяма:
Яд, мудрецом предложенный, прими,
Из рук же дурака не принимай бальзама","Общаясь с дураком не оберешься срама,
Поэтому совет ты выслушай Хайяма:
Яд, мудрецом предложенный, прими,
Из рук же дурака не принимай бальзама"
"Не пристало хороших людей обижать,
Не пристало, как хищник в пустыне, рычать.
Не умно похваляться добытым богатством,
Не пристало за званья себя почитать!","Не пристало хороших людей обижать,
Не пристало, как хищник в пустыне, рычать.
Не умно похваляться добытым богатством,
Не пристало за званья себя почитать!"
"Мы за равенство только с теми, кто нас превосходит.","Мы за равенство только с теми, кто нас превосходит."
Вовремя смыться - тоже большое искусство.,Вовремя смыться - тоже большое искусство.
"Чтобы мы видели, сколько мы переедаем, наш живот расположен на той же стороне, что и глаза.","Чтобы мы видели, сколько мы переедаем, наш живот расположен на той же стороне, что и глаза."
Все в этой книге может оказаться ошибкой.,Все в этой книге может оказаться ошибкой.
"Когда даёшь себя приручить, потом случается и плакать.","Когда даёшь себя приручить, потом случается и плакать."
"Ты скажешь эта жизнь — одно мгновенье.
Её цени, в ней черпай вдохновенье.
Как проведёшь её, так и пройдёт,
Не забывай: она — твоё творенье.","Ты скажешь эта жизнь — одно мгновенье.
Её цени, в ней черпай вдохновенье.
Как проведёшь её, так и пройдёт,
Не забывай: она — твоё творенье."
"Если у вас есть возможность явить милосердие, не пропускайте вперед даже учителя.","Если у вас есть возможность явить милосердие, не пропускайте вперед даже учителя."
"Все, что ты говоришь, говорит о тебе, и особенно то, что ты говоришь о других.","Все, что ты говоришь, говорит о тебе, и особенно то, что ты говоришь о других."
"Когда я умру, похороните меня и на памятнике напишите: ""Умерла от отвращения"".","Когда я умру, похороните меня и на памятнике напишите: ""Умерла от отвращения""."
