Question,Answer
"Не поговорить с человеком, который достоин разговора, значит потерять человека. А говорить с человеком, который разговора не достоин, — значит терять слова. Мудрый не теряет ни людей, ни слов.","Не поговорить с человеком, который достоин разговора, значит потерять человека. А говорить с человеком, который разговора не достоин, — значит терять слова. Мудрый не теряет ни людей, ни слов."
"Всю жизнь я страшно боюсь глупых. Особенно баб. Никогда не знаешь, как с ними разговаривать, не скатываясь на их уровень.","Всю жизнь я страшно боюсь глупых. Особенно баб. Никогда не знаешь, как с ними разговаривать, не скатываясь на их уровень."
"Жизнь слишком коротка, чтобы тратить ее на диеты, жадных мужчин и плохое настроение.","Жизнь слишком коротка, чтобы тратить ее на диеты, жадных мужчин и плохое настроение."
"Да, человек смертен, но это было бы еще полбеды. Плохо то, что он иногда внезапно смертен, вот в чем фокус!","Да, человек смертен, но это было бы еще полбеды. Плохо то, что он иногда внезапно смертен, вот в чем фокус!"
"На голодный желудок русский человек ничего делать и думать не хочет, а на сытый — не может.","На голодный желудок русский человек ничего делать и думать не хочет, а на сытый — не может."
"Чтобы мы видели, сколько мы переедаем, наш живот расположен на той же стороне, что и глаза.","Чтобы мы видели, сколько мы переедаем, наш живот расположен на той же стороне, что и глаза."
"Проклятый девятнадцатый век, проклятое воспитание: не могу стоять, когда мужчины сидят.","Проклятый девятнадцатый век, проклятое воспитание: не могу стоять, когда мужчины сидят."
"Танцуй так, как будто на тебя никто не смотрит. Пой, как будто тебя никто не слышит. Люби так, как будто тебя никогда не предавали, и живи так, как будто земля — это рай.","Танцуй так, как будто на тебя никто не смотрит. Пой, как будто тебя никто не слышит. Люби так, как будто тебя никогда не предавали, и живи так, как будто земля — это рай."
Глаза слепы. Искать надо сердцем.,Глаза слепы. Искать надо сердцем.
"Если есть у тебя для жилья закуток —
В наше подлое время — и хлеба кусок,
Если ты никому не слуга, не хозяин —
Счастлив ты и воистину духом высок.","Если есть у тебя для жилья закуток —
В наше подлое время — и хлеба кусок,
Если ты никому не слуга, не хозяин —
Счастлив ты и воистину духом высок."
"Не удерживай то, что уходит, и не отталкивай то, что приходит. И тогда счастье само найдет тебя.","Не удерживай то, что уходит, и не отталкивай то, что приходит. И тогда счастье само найдет тебя."
"Себя судить куда труднее, чем других. Если ты сумеешь правильно судить себя, значит, ты поистине мудр.","Себя судить куда труднее, чем других. Если ты сумеешь правильно судить себя, значит, ты поистине мудр."
"Там хорошо, где нас нет.","Там хорошо, где нас нет."
"Когда уходите на пять минут,
Не забывайте оставлять тепло в ладонях.
В ладонях тех, которые вас ждут,
В ладонях тех, которые вас помнят...","Когда уходите на пять минут,
Не забывайте оставлять тепло в ладонях.
В ладонях тех, которые вас ждут,
В ладонях тех, которые вас помнят..."
"Когда я умру, похороните меня и на памятнике напишите: ""Умерла от отвращения"".","Когда я умру, похороните меня и на памятнике напишите: ""Умерла от отвращения""."
"Склероз нельзя вылечить, но о нем можно забыть.","Склероз нельзя вылечить, но о нем можно забыть."
"Жизнь проходит и не кланяется, как сердитая соседка.","Жизнь проходит и не кланяется, как сердитая соседка."
"Если больной очень хочет жить, врачи бессильны.","Если больной очень хочет жить, врачи бессильны."
"Известно, в мире все лишь суета сует:
Будь весел, не горюй, стоит на этом свет.
Что было, то прошло, что будет — неизвестно,
Так не тужи о том, чего сегодня нет.","Известно, в мире все лишь суета сует:
Будь весел, не горюй, стоит на этом свет.
Что было, то прошло, что будет — неизвестно,
Так не тужи о том, чего сегодня нет."
"Жить надо так, чтобы тебя помнили и сволочи.","Жить надо так, чтобы тебя помнили и сволочи."
Мне всегда было непонятно - люди стыдятся бедности и не стыдятся богатства.,Мне всегда было непонятно - люди стыдятся бедности и не стыдятся богатства.
Сняться в плохом фильме - все равно что плюнуть в вечность.,Сняться в плохом фильме - все равно что плюнуть в вечность.
"Выберите себе работу по душе, и вам не придется работать ни одного дня в своей жизни.","Выберите себе работу по душе, и вам не придется работать ни одного дня в своей жизни."
"Если у тебя есть человек, которому можно рассказать сны, ты не имеешь права считать себя одиноким...","Если у тебя есть человек, которому можно рассказать сны, ты не имеешь права считать себя одиноким..."
