Question,Answer
"Человек без сюрприза внутри, в своём ящике, неинтересен.","Человек без сюрприза внутри, в своём ящике, неинтересен."
Здоровье - это когда у вас каждый день болит в другом месте.,Здоровье - это когда у вас каждый день болит в другом месте.
Всю свою жизнь я проплавала в унитазе стилем баттерфляй.,Всю свою жизнь я проплавала в унитазе стилем баттерфляй.
"Сейчас, когда человек стесняется сказать, что ему не хочется умирать, он говорит так: очень хочется выжить, чтобы посмотреть, что будет потом. Как будто если бы не это, он немедленно был бы готов лечь в гроб.","Сейчас, когда человек стесняется сказать, что ему не хочется умирать, он говорит так: очень хочется выжить, чтобы посмотреть, что будет потом. Как будто если бы не это, он немедленно был бы готов лечь в гроб."
"Когда даёшь себя приручить, потом случается и плакать.","Когда даёшь себя приручить, потом случается и плакать."
"То, что Бог нам однажды отмерил, друзья,
Увеличить нельзя и уменьшить нельзя.
Постараемся с толком истратить наличность,
На чужое не зарясь, взаймы не прося.","То, что Бог нам однажды отмерил, друзья,
Увеличить нельзя и уменьшить нельзя.
Постараемся с толком истратить наличность,
На чужое не зарясь, взаймы не прося."
"Счастье - это когда тебя понимают, большое счастье - это когда тебя любят, настоящее счастье - это когда любишь ты.","Счастье - это когда тебя понимают, большое счастье - это когда тебя любят, настоящее счастье - это когда любишь ты."
"Неправда, что женатые мужчины при виде красивой женщины забывают о том, что они женаты. В эту минуту их особенно удручает именно воспоминание об этом.","Неправда, что женатые мужчины при виде красивой женщины забывают о том, что они женаты. В эту минуту их особенно удручает именно воспоминание об этом."
"Я заметила, что если не кушать хлеб, сахар, жирное мясо, не пить пиво с рыбкой – морда становится меньше, но грустнее.","Я заметила, что если не кушать хлеб, сахар, жирное мясо, не пить пиво с рыбкой – морда становится меньше, но грустнее."
И что только ни делает с человеком природа!,И что только ни делает с человеком природа!
"Когда у попрыгуньи болят ноги, она прыгает сидя.","Когда у попрыгуньи болят ноги, она прыгает сидя."
Воспоминания — это богатства старости.,Воспоминания — это богатства старости.
Благородный в душе безмятежен. Низкий человек всегда озабочен.,Благородный в душе безмятежен. Низкий человек всегда озабочен.
"Мы — послушные куклы в руках у творца!
Это сказано мною не ради словца.
Нас по сцене всевышний на ниточках водит
И пихает в сундук, доведя до конца.","Мы — послушные куклы в руках у творца!
Это сказано мною не ради словца.
Нас по сцене всевышний на ниточках водит
И пихает в сундук, доведя до конца."
"Не зли других и сам не злись,
Мы гости в этом бренном мире.
И, если что не так — смирись!
Будь поумней и улыбнись.
Холодной думай головой.
Ведь в мире все закономерно:
Зло, излученное тобой,
К тебе вернется непременно.","Не зли других и сам не злись,
Мы гости в этом бренном мире.
И, если что не так — смирись!
Будь поумней и улыбнись.
Холодной думай головой.
Ведь в мире все закономерно:
Зло, излученное тобой,
К тебе вернется непременно."
"Мысли тянутся к началу жизни - значит, жизнь подходит к концу.","Мысли тянутся к началу жизни - значит, жизнь подходит к концу."
"Я себя чувствую, но плохо.","Я себя чувствую, но плохо."
"Строить правильно отношения труднее всего с женщинами и низкими людьми. Если приблизишь их к себе — они станут развязными, если удалишь от себя — возненавидят.","Строить правильно отношения труднее всего с женщинами и низкими людьми. Если приблизишь их к себе — они станут развязными, если удалишь от себя — возненавидят."
"Попытайтесь быть хотя бы немного добрее, и вы увидите, что будете не в состоянии совершить дурной поступок.","Попытайтесь быть хотя бы немного добрее, и вы увидите, что будете не в состоянии совершить дурной поступок."
Оптимизм — это недостаток информации.,Оптимизм — это недостаток информации.
(Глядя на прореху в своей юбке) Напора красоты не может сдержать ничто!,(Глядя на прореху в своей юбке) Напора красоты не может сдержать ничто!
"Старость - это просто свинство. Я считаю, что это невежество Бога, когда он позволяет доживать до старости.","Старость - это просто свинство. Я считаю, что это невежество Бога, когда он позволяет доживать до старости."
У каждого человека свои звезды.,У каждого человека свои звезды.
"При встрече с достойным человеком думай о том, как сравняться с ним. Встречаясь с низким человеком, присматривайся к самому себе и сам себя суди.","При встрече с достойным человеком думай о том, как сравняться с ним. Встречаясь с низким человеком, присматривайся к самому себе и сам себя суди."
"Есть люди, в которых живёт Бог; есть люди, в которых живёт Дьявол; а есть люди, в которых живут только глисты.","Есть люди, в которых живёт Бог; есть люди, в которых живёт Дьявол; а есть люди, в которых живут только глисты."
Одиночество как состояние не поддается лечению.,Одиночество как состояние не поддается лечению.
"Ты выбрался из грязи в князи,
Но, быстро князем становясь,
Не позабудь, чтобы не сглазить,
Не вечны князи - вечна грязь.","Ты выбрался из грязи в князи,
Но, быстро князем становясь,
Не позабудь, чтобы не сглазить,
Не вечны князи - вечна грязь."
"И с другом и с врагом ты должен быть хорош!
Кто по натуре добр, в том злобы не найдешь.
Обидишь друга — наживешь врага ты
Врага обнимешь — друга наживешь.","И с другом и с врагом ты должен быть хорош!
Кто по натуре добр, в том злобы не найдешь.
Обидишь друга — наживешь врага ты
Врага обнимешь — друга наживешь."
"Одиночество — это когда в доме есть телефон, а звонит будильник.","Одиночество — это когда в доме есть телефон, а звонит будильник."
"Люди забираются в скорые поезда, но они уже сами не понимают, чего ищут. Поэтому они не знают покоя и бросаются то в одну сторону, то в другую... И все напрасно...","Люди забираются в скорые поезда, но они уже сами не понимают, чего ищут. Поэтому они не знают покоя и бросаются то в одну сторону, то в другую... И все напрасно..."
Только о двух вещах мы будем жалеть на смертном одре — что мало любили и мало путешествовали.,Только о двух вещах мы будем жалеть на смертном одре — что мало любили и мало путешествовали.
Чем я занимаюсь? Симулирую здоровье.,Чем я занимаюсь? Симулирую здоровье.
"Не делай другому того, чего себе не пожелаешь.","Не делай другому того, чего себе не пожелаешь."
Кирпич ни с того ни с сего никому и никогда на голову не свалится.,Кирпич ни с того ни с сего никому и никогда на голову не свалится.
"Мы в ответе за тех, кого приручили...","Мы в ответе за тех, кого приручили..."
"Страшно, когда тебе внутри восемнадцать, когда восхищаешься прекрасной музыкой, стихами, живописью, а тебе уже пора, ты ничего не успела, а только начинаешь жить!","Страшно, когда тебе внутри восемнадцать, когда восхищаешься прекрасной музыкой, стихами, живописью, а тебе уже пора, ты ничего не успела, а только начинаешь жить!"
"Мне попадаются не лица, а личное оскорбление.","Мне попадаются не лица, а личное оскорбление."
"Зачем же гнаться по следам того, что уже окончено?","Зачем же гнаться по следам того, что уже окончено?"
"Я ведь еще помню порядочных людей...  Боже, какая я старая!","Я ведь еще помню порядочных людей...  Боже, какая я старая!"
"Тщеславные люди глухи ко всему, кроме похвал.","Тщеславные люди глухи ко всему, кроме похвал."
"Если вы подберете на улице дворовую собаку и накормите ее, она никогда вас не укусит. В этом и состоит разница между собакой и человеком.","Если вы подберете на улице дворовую собаку и накормите ее, она никогда вас не укусит. В этом и состоит разница между собакой и человеком."
"Лучше впасть в нищету, голодать или красть,
Чем в число блюдолизов презренных попасть,
Лучше кости глодать, чем прельститься страстям,
За столом у мерзавцев, имеющих власть.","Лучше впасть в нищету, голодать или красть,
Чем в число блюдолизов презренных попасть,
Лучше кости глодать, чем прельститься страстям,
За столом у мерзавцев, имеющих власть."
"Кто битым жизнью был, тот большего добьется.
Пуд соли съевший, выше ценит мед.
Кто слезы лил, тот искренней смеется.
Кто умирал, тот знает, что живет...","Кто битым жизнью был, тот большего добьется.
Пуд соли съевший, выше ценит мед.
Кто слезы лил, тот искренней смеется.
Кто умирал, тот знает, что живет..."
Зорко одно лишь сердце. Самого главного глазами не увидишь.,Зорко одно лишь сердце. Самого главного глазами не увидишь.
"Жизнь — как вождение велосипеда. Чтобы сохранить равновесие, ты должен двигаться.","Жизнь — как вождение велосипеда. Чтобы сохранить равновесие, ты должен двигаться."
"Семья заменяет все. Поэтому, прежде чем ее завести, стоит подумать, что тебе важнее: все или семья.","Семья заменяет все. Поэтому, прежде чем ее завести, стоит подумать, что тебе важнее: все или семья."
Жизнь — это небольшая прогулка перед вечным сном.,Жизнь — это небольшая прогулка перед вечным сном.
"Тот, кто, дожив до сорока лет, вызывает лишь неприязнь, - конченый человек.","Тот, кто, дожив до сорока лет, вызывает лишь неприязнь, - конченый человек."
"Того, кто не задумывается о далеких трудностях, непременно поджидают близкие неприятности.","Того, кто не задумывается о далеких трудностях, непременно поджидают близкие неприятности."
"Некто спросил: ""Правильно ли говорят, что за зло нужно платить добром?"" Учитель сказал: ""А чем же тогда платить за добро? За зло надо платить по справедливости, а за добро — добром"".","Некто спросил: ""Правильно ли говорят, что за зло нужно платить добром?"" Учитель сказал: ""А чем же тогда платить за добро? За зло надо платить по справедливости, а за добро — добром""."
"Сказка - это когда женился на лягушке, а она оказалась царевной. А быль - это когда наоборот.","Сказка - это когда женился на лягушке, а она оказалась царевной. А быль - это когда наоборот."
Спутник славы - одиночество.,Спутник славы - одиночество.
Отпускайте идиотов и клоунов из своей жизни. Цирк должен гастролировать.,Отпускайте идиотов и клоунов из своей жизни. Цирк должен гастролировать.
"Старость - это время, когда свечи на именинном пироге обходятся дороже самого пирога, а половина мочи идет на анализы.","Старость - это время, когда свечи на именинном пироге обходятся дороже самого пирога, а половина мочи идет на анализы."
"Чтоб мудро жизнь прожить, знать надобно немало,
Два важных правила запомни для начала:
Ты лучше голодай, чем что попало есть,
И лучше будь один, чем вместе с кем попало.","Чтоб мудро жизнь прожить, знать надобно немало,
Два важных правила запомни для начала:
Ты лучше голодай, чем что попало есть,
И лучше будь один, чем вместе с кем попало."
"Все приятное в этом мире либо вредно, либо аморально, либо ведет к ожирению.","Все приятное в этом мире либо вредно, либо аморально, либо ведет к ожирению."
"Как мы можем знать, что такое смерть, когда мы не знаем еще, что такое жизнь?","Как мы можем знать, что такое смерть, когда мы не знаем еще, что такое жизнь?"
Жизнь — это затяжной прыжок из п...ды в могилу.,Жизнь — это затяжной прыжок из п...ды в могилу.
У меня хватило ума глупо прожить жизнь.,У меня хватило ума глупо прожить жизнь.
"В древности люди учились для того, чтобы совершенствовать себя. Нынче учатся для того, чтобы удивить других.","В древности люди учились для того, чтобы совершенствовать себя. Нынче учатся для того, чтобы удивить других."
Правду говорить легко и приятно.,Правду говорить легко и приятно.
"Если ты хочешь, чтобы кто-то остался в твоей жизни, - никогда не относись к нему равнодушно.","Если ты хочешь, чтобы кто-то остался в твоей жизни, - никогда не относись к нему равнодушно."
"Толстой сказал, что смерти нет, а есть любовь и память сердца. Память сердца так мучительна, лучше бы ее не было... Лучше бы память навсегда убить.","Толстой сказал, что смерти нет, а есть любовь и память сердца. Память сердца так мучительна, лучше бы ее не было... Лучше бы память навсегда убить."
"Я не понимаю, как можно иметь дело с человеком, которому нельзя доверять? Если в повозке нет оси, как можно на ней ездить?","Я не понимаю, как можно иметь дело с человеком, которому нельзя доверять? Если в повозке нет оси, как можно на ней ездить?"
"Я как старая пальма на вокзале - никому не нужна, а выбросить жалко.","Я как старая пальма на вокзале - никому не нужна, а выбросить жалко."
"Старость - это когда беспокоят не плохие сны, а плохая действительность.","Старость - это когда беспокоят не плохие сны, а плохая действительность."
"Бог мой, как прошмыгнула жизнь, я даже никогда не слышала, как поют соловьи.","Бог мой, как прошмыгнула жизнь, я даже никогда не слышала, как поют соловьи."
"Нас приучили к одноклеточным словам, куцым мыслям, играй после этого Островского!","Нас приучили к одноклеточным словам, куцым мыслям, играй после этого Островского!"
"Если вы хотите иметь то, что никогда не имели, — начните делать то, что никогда не делали.","Если вы хотите иметь то, что никогда не имели, — начните делать то, что никогда не делали."
"Никогда и ничего не просите! Никогда и ничего, и в особенности у тех, кто сильнее вас. Сами предложат и сами всё дадут!","Никогда и ничего не просите! Никогда и ничего, и в особенности у тех, кто сильнее вас. Сами предложат и сами всё дадут!"
"Стареть скучно, но это единственный способ жить долго.","Стареть скучно, но это единственный способ жить долго."
Счастье — это когда у тебя все дома!,Счастье — это когда у тебя все дома!
"В этом мире неверном не будь дураком:
Полагаться не вздумай на тех, кто кругом.
Трезвым оком взгляни на ближайшего друга -
Друг, возможно, окажется злейшим врагом.","В этом мире неверном не будь дураком:
Полагаться не вздумай на тех, кто кругом.
Трезвым оком взгляни на ближайшего друга -
Друг, возможно, окажется злейшим врагом."
"Не беспокойся о том, что у тебя нет высокого чина. Беспокойся о том, достоин ли ты того, чтобы иметь высокий чин. Не беспокойся о том, что тебя не знают. Беспокойся о том, достоин ли ты того, чтобы тебя знали.","Не беспокойся о том, что у тебя нет высокого чина. Беспокойся о том, достоин ли ты того, чтобы иметь высокий чин. Не беспокойся о том, что тебя не знают. Беспокойся о том, достоин ли ты того, чтобы тебя знали."
"Чтобы привлечь что-то в свою жизнь, представь, что оно там уже есть.","Чтобы привлечь что-то в свою жизнь, представь, что оно там уже есть."
Посылать людей на войну необученными — значит предавать их.,Посылать людей на войну необученными — значит предавать их.
