Question,Answer
"Человек без сюрприза внутри, в своём ящике, неинтересен.","Человек без сюрприза внутри, в своём ящике, неинтересен."
Здоровье - это когда у вас каждый день болит в другом месте.,Здоровье - это когда у вас каждый день болит в другом месте.
"Если вы решили действовать, закройте двери для сомнений.","Если вы решили действовать, закройте двери для сомнений."
"Человек, который думает только о себе и ищет во всем своей выгоды, не может быть счастлив. Хочешь жить для себя, живи для других.","Человек, который думает только о себе и ищет во всем своей выгоды, не может быть счастлив. Хочешь жить для себя, живи для других."
Каждый может стать благородным мужем. Нужно только решиться им стать.,Каждый может стать благородным мужем. Нужно только решиться им стать.
"Если вы хотите вести счастливую жизнь, вы должны быть привязаны к цели, а не к людям или к вещам.","Если вы хотите вести счастливую жизнь, вы должны быть привязаны к цели, а не к людям или к вещам."
"Словно ветер в степи, словно в речке вода,
День прошел — и назад не придет никогда.
Будем жить, о подруга моя, настоящим!
Сожалеть о минувшем — не стоит труда.","Словно ветер в степи, словно в речке вода,
День прошел — и назад не придет никогда.
Будем жить, о подруга моя, настоящим!
Сожалеть о минувшем — не стоит труда."
"Воспитание мужчины или женщины проверяется тем, как они ведут себя во время ссоры.","Воспитание мужчины или женщины проверяется тем, как они ведут себя во время ссоры."
"Да пребудет со мною любовь и вино!
Будь, что будет: безумье, позор – всё равно!
Чему быть суждено – неминуемо будет,
Но не больше того, чему быть суждено.","Да пребудет со мною любовь и вино!
Будь, что будет: безумье, позор – всё равно!
Чему быть суждено – неминуемо будет,
Но не больше того, чему быть суждено."
"Уважай себя настолько, чтобы не отдавать всех сил души и сердца тому, кому они не нужны...","Уважай себя настолько, чтобы не отдавать всех сил души и сердца тому, кому они не нужны..."
И что только ни делает с человеком природа!,И что только ни делает с человеком природа!
"Сторонитесь людей, которые пытаются уменьшить ваши амбиции. Маленькие люди делают это всегда. Большие же люди, напротив, дают вам почувствовать, что вы тоже можете стать великим.","Сторонитесь людей, которые пытаются уменьшить ваши амбиции. Маленькие люди делают это всегда. Большие же люди, напротив, дают вам почувствовать, что вы тоже можете стать великим."
"Люди иногда называют дружбой совместное времяпрепровождение, взаимную помощь в делах, обмен услугами. Одним словом — такие отношения, где себялюбие надеется что-нибудь выгадать.","Люди иногда называют дружбой совместное времяпрепровождение, взаимную помощь в делах, обмен услугами. Одним словом — такие отношения, где себялюбие надеется что-нибудь выгадать."
"В жизни побеждает глупец. А умному везде чудятся одни лишь препятствия, и, не успев что-то начать, он уже потерял уверенность в себе.","В жизни побеждает глупец. А умному везде чудятся одни лишь препятствия, и, не успев что-то начать, он уже потерял уверенность в себе."
Воспоминания — это богатства старости.,Воспоминания — это богатства старости.
"Что может дать один человек другому, кроме капли тепла? И что может быть больше этого?","Что может дать один человек другому, кроме капли тепла? И что может быть больше этого?"
"Целью школы всегда должно быть воспитание гармоничной личности, а не специалиста.","Целью школы всегда должно быть воспитание гармоничной личности, а не специалиста."
Если в мире все бессмысленно - что мешает выдумать какой-нибудь смысл?,Если в мире все бессмысленно - что мешает выдумать какой-нибудь смысл?
"Не приходи в уныние при расставаниях. Прощание необходимо для того, чтобы вы смогли встретиться вновь. А новая встреча, спустя мгновение или многие жизни, несомненна для тех, кто является друзьями.","Не приходи в уныние при расставаниях. Прощание необходимо для того, чтобы вы смогли встретиться вновь. А новая встреча, спустя мгновение или многие жизни, несомненна для тех, кто является друзьями."
"Самый чудесный город это тот, где человек счастлив.","Самый чудесный город это тот, где человек счастлив."
Оптимизм — это недостаток информации.,Оптимизм — это недостаток информации.
"Брак — не лучший способ сохранить любовь, но любовь — лучший способ сохранить брак.","Брак — не лучший способ сохранить любовь, но любовь — лучший способ сохранить брак."
Я никогда не думаю о будущем. Оно приходит само достаточно скоро.,Я никогда не думаю о будущем. Оно приходит само достаточно скоро.
"Образование — это то, что остаётся после того, как забывается всё выученное в школе.","Образование — это то, что остаётся после того, как забывается всё выученное в школе."
"Хорошо, что у людей еще остается много важных мелочей, которые приковывают их к жизни, защищают от нее. А вот одиночество — настоящее одиночество, без всяких иллюзий — наступает перед безумием или самоубийством.","Хорошо, что у людей еще остается много важных мелочей, которые приковывают их к жизни, защищают от нее. А вот одиночество — настоящее одиночество, без всяких иллюзий — наступает перед безумием или самоубийством."
"Мы все свободны поступать так, как мы того захотим.","Мы все свободны поступать так, как мы того захотим."
"Однажды я провел в размышлениях целый день без еды и целую ночь без сна, но я ничего не добился. Было бы лучше посвятить то время учению.","Однажды я провел в размышлениях целый день без еды и целую ночь без сна, но я ничего не добился. Было бы лучше посвятить то время учению."
"Если ты не можешь изменить мир, измени отношение к этому миру.","Если ты не можешь изменить мир, измени отношение к этому миру."
"Одиночество — это когда в доме есть телефон, а звонит будильник.","Одиночество — это когда в доме есть телефон, а звонит будильник."
"Самое худшее, когда нужно ждать и не можешь ничего сделать. От этого можно сойти с ума.","Самое худшее, когда нужно ждать и не можешь ничего сделать. От этого можно сойти с ума."
Люди в древности не любили много говорить. Они считали позором для себя не поспеть за собственными словами.,Люди в древности не любили много говорить. Они считали позором для себя не поспеть за собственными словами.
"Люди забираются в скорые поезда, но они уже сами не понимают, чего ищут. Поэтому они не знают покоя и бросаются то в одну сторону, то в другую... И все напрасно...","Люди забираются в скорые поезда, но они уже сами не понимают, чего ищут. Поэтому они не знают покоя и бросаются то в одну сторону, то в другую... И все напрасно..."
"В этом замкнутом круге — крути не крути -
Не удастся конца и начала найти.
Наша роль в этом мире — прийти и уйти.
Кто нам скажет о цели, о смысле пути?","В этом замкнутом круге — крути не крути -
Не удастся конца и начала найти.
Наша роль в этом мире — прийти и уйти.
Кто нам скажет о цели, о смысле пути?"
"Вам знакомо выражение ""выше головы не прыгнешь""? Это заблуждение. Человек может все.","Вам знакомо выражение ""выше головы не прыгнешь""? Это заблуждение. Человек может все."
"Благородный не стремится есть досыта и жить богато. Он поспешает в делах, но медлит в речах. Общаясь с людьми добродетельными, он исправляет себя. Вот о таком человеке можно сказать, что он предан учению.","Благородный не стремится есть досыта и жить богато. Он поспешает в делах, но медлит в речах. Общаясь с людьми добродетельными, он исправляет себя. Вот о таком человеке можно сказать, что он предан учению."
Чем я занимаюсь? Симулирую здоровье.,Чем я занимаюсь? Симулирую здоровье.
"Человечный муж не будет находиться долго в стеснённых обстоятельствах, но он также не будет долго пребывать в праздности.","Человечный муж не будет находиться долго в стеснённых обстоятельствах, но он также не будет долго пребывать в праздности."
"Свою слепить бы жизнь из самых умных дел
Там не додумался, тут вовсе не сумел.
Но Время — вот у нас учитель расторопный!
Как подзатыльник даст, ты малость поумнел.","Свою слепить бы жизнь из самых умных дел
Там не додумался, тут вовсе не сумел.
Но Время — вот у нас учитель расторопный!
Как подзатыльник даст, ты малость поумнел."
"Почтительный сын — это тот, кто огорчает отца и мать разве что своей болезнью.","Почтительный сын — это тот, кто огорчает отца и мать разве что своей болезнью."
"Мне попадаются не лица, а личное оскорбление.","Мне попадаются не лица, а личное оскорбление."
"Пока человек не сдаётся, он сильнее своей судьбы.","Пока человек не сдаётся, он сильнее своей судьбы."
"Один, глядя в лужу, видит в ней грязь, а другой — отражающиеся в ней звезды.","Один, глядя в лужу, видит в ней грязь, а другой — отражающиеся в ней звезды."
"Только идиоты утверждают, что они не идиоты. Противоречить им бесполезно.","Только идиоты утверждают, что они не идиоты. Противоречить им бесполезно."
"Зачем же гнаться по следам того, что уже окончено?","Зачем же гнаться по следам того, что уже окончено?"
"Когда чего-нибудь сильно захочешь, вся Вселенная будет способствовать тому, чтобы желание твое сбылось.","Когда чего-нибудь сильно захочешь, вся Вселенная будет способствовать тому, чтобы желание твое сбылось."
Одиночество — удел сильных. Слабые всегда жмутся к толпе.,Одиночество — удел сильных. Слабые всегда жмутся к толпе.
"Благородный стойко переносит беды, а низкий человек в беде распускается.","Благородный стойко переносит беды, а низкий человек в беде распускается."
"Разумно ль смерти мне страшиться? Только раз
Я ей взгляну в лицо, когда придет мой час.","Разумно ль смерти мне страшиться? Только раз
Я ей взгляну в лицо, когда придет мой час."
Если твоя судьба не вызывает у тебя смеха - значит ты не понял шутки.,Если твоя судьба не вызывает у тебя смеха - значит ты не понял шутки.
"Иногда думаешь, что все хорошо, а кто-то уже роет тебе могилу...","Иногда думаешь, что все хорошо, а кто-то уже роет тебе могилу..."
"Каждый человек, появляющийся в твоей жизни, все события, которые с тобой происходят, - всё это случается с тобой потому, что это ты притянул их сюда. И то, что ты делаешь со всем этим дальше, ты выбираешь сам.","Каждый человек, появляющийся в твоей жизни, все события, которые с тобой происходят, - всё это случается с тобой потому, что это ты притянул их сюда. И то, что ты делаешь со всем этим дальше, ты выбираешь сам."
"Одиночество легче, когда не любишь.","Одиночество легче, когда не любишь."
"Цель жизни — поиск совершенства, а задача каждого из нас — максимально приблизить его проявление в самом себе.","Цель жизни — поиск совершенства, а задача каждого из нас — максимально приблизить его проявление в самом себе."
"Тот, кто, дожив до сорока лет, вызывает лишь неприязнь, - конченый человек.","Тот, кто, дожив до сорока лет, вызывает лишь неприязнь, - конченый человек."
"Мужчина, способный на поступки, обречен быть любимым!","Мужчина, способный на поступки, обречен быть любимым!"
"С добром надо спешить, иначе оно может остаться без адресата.","С добром надо спешить, иначе оно может остаться без адресата."
"Если человек тверд, решителен, прост и несловоохотлив, то он уже близок к человечности.","Если человек тверд, решителен, прост и несловоохотлив, то он уже близок к человечности."
"Секс хорош года примерно на два, а потом уже вам необходима любовь.","Секс хорош года примерно на два, а потом уже вам необходима любовь."
"Важно не то, проиграем ли мы в игре, а важно как мы проиграем и как благодаря этому изменимся, что нового вынесем для себя, как сможем применить это в других играх. Странным способом поражение оказывается победой.","Важно не то, проиграем ли мы в игре, а важно как мы проиграем и как благодаря этому изменимся, что нового вынесем для себя, как сможем применить это в других играх. Странным способом поражение оказывается победой."
Спутник славы - одиночество.,Спутник славы - одиночество.
"Ни одно желание не даётся тебе отдельно от силы, позволяющей его осуществить.","Ни одно желание не даётся тебе отдельно от силы, позволяющей его осуществить."
"Что такое человеческая жизнь? Первая треть – хорошее время; остальное – воспоминание о нем.","Что такое человеческая жизнь? Первая треть – хорошее время; остальное – воспоминание о нем."
"Мир я сравнил бы с шахматной доской -
То день, то ночь. А пешки? Мы с тобой.
Подвигают, притиснут и — побили.
И в темный ящик сунут на покой.","Мир я сравнил бы с шахматной доской -
То день, то ночь. А пешки? Мы с тобой.
Подвигают, притиснут и — побили.
И в темный ящик сунут на покой."
"Чем больше пустяков считаешь везением, тем чаще тебе везет.","Чем больше пустяков считаешь везением, тем чаще тебе везет."
"Чтоб мудро жизнь прожить, знать надобно немало,
Два важных правила запомни для начала:
Ты лучше голодай, чем что попало есть,
И лучше будь один, чем вместе с кем попало.","Чтоб мудро жизнь прожить, знать надобно немало,
Два важных правила запомни для начала:
Ты лучше голодай, чем что попало есть,
И лучше будь один, чем вместе с кем попало."
"Когда мы осмыслим свою роль на земле, пусть самую скромную и незаметную, тогда лишь мы будем счастливы. Тогда лишь мы сможем жить и умирать спокойно, ибо то, что дает смысл жизни, дает и смысл смерти.","Когда мы осмыслим свою роль на земле, пусть самую скромную и незаметную, тогда лишь мы будем счастливы. Тогда лишь мы сможем жить и умирать спокойно, ибо то, что дает смысл жизни, дает и смысл смерти."
Бессмысленно продолжать делать то же самое и ждать других результатов.,Бессмысленно продолжать делать то же самое и ждать других результатов.
"Благородный думает о должном. Низкий человек думает о том, что выгодно.","Благородный думает о должном. Низкий человек думает о том, что выгодно."
"Всегда честно признавай свои ошибки, это притупит бдительность начальства и позволит тебе натворить новые.","Всегда честно признавай свои ошибки, это притупит бдительность начальства и позволит тебе натворить новые."
"С людьми тяжело, без них — невыносимо.","С людьми тяжело, без них — невыносимо."
"В древности люди учились для того, чтобы совершенствовать себя. Нынче учатся для того, чтобы удивить других.","В древности люди учились для того, чтобы совершенствовать себя. Нынче учатся для того, чтобы удивить других."
"В мире был всего один христианин, люди его осудили и казнили.","В мире был всего один христианин, люди его осудили и казнили."
"Но какая в том польза, даже если знаешь, что другой прав? Разум дан человеку, чтобы он понял: жить одним разумом нельзя. Люди живут чувствами, а для чувств безразлично, кто прав.","Но какая в том польза, даже если знаешь, что другой прав? Разум дан человеку, чтобы он понял: жить одним разумом нельзя. Люди живут чувствами, а для чувств безразлично, кто прав."
